{
  "schema_version": "1.0",
  "snapshot_id": "geocoder-release-3d8b3f53cf9e",
  "kind": "geocoder",
  "sources": [
    {
      "publisher": "Building Code Map",
      "product": "release geocoder fixtures",
      "vintage": "3d8b3f53cf9ebc448fc92d847f9b01054c08f046",
      "locator": "backend/geocoder/testdata",
      "sha256": "635ae6a70342b720ce319c3d4fef5a9e9f7c3f0f9e3cec3c654bbcac2d175177",
      "retrieved_at": "2026-08-06T20:58:47-06:00",
      "license_review_status": "reviewed",
      "redistribution_status": "repository-owned",
      "input_crs": "EPSG:4326",
      "transformation": "normalized deterministic fixture import"
    }
  ],
  "builder": {
    "tool": "geocoder-build",
    "version": "0.1.0",
    "revision": "3d8b3f53cf9ebc448fc92d847f9b01054c08f046",
    "built_at": "2026-08-06T20:58:47-06:00",
    "output_crs": "EPSG:4326"
  },
  "record_counts": {
    "accepted": 5,
    "rejected": 0,
    "duplicate": 0,
    "quarantined": 0
  },
  "output_sha256": "df7e31dc1ec81c42197acf7c107928db4c1ff7573e88f32316fe74f03e29d957",
  "output_size_bytes": 36864,
  "integrity_checks": [
    {
      "name": "fixture-import",
      "status": "passed"
    }
  ]
}
